{
  "$schema": "https://json-schema.org/draft/2020-12/schema",
  "$id": "feedback.schema.json",
  "title": "Persona feedback report",
  "type": "object",
  "required": ["persona_id", "target", "task", "outcome", "findings"],
  "properties": {
    "persona_id": { "type": "string" },
    "target": { "type": "string", "format": "uri" },
    "task": { "type": "string" },
    "started_at": {
      "type": "string",
      "format": "date-time",
      "description": "Wall-clock time of the first CLI command, written by apply-trace-timing.mjs from the CLI trace. persona-runner does not write it."
    },
    "duration_seconds": {
      "type": "number",
      "minimum": 0,
      "description": "Seconds from the first to the last CLI command, measured from the CLI trace. persona-runner does not write it."
    },
    "timing": {
      "type": "object",
      "description": "How action_log.at_seconds was obtained. Written by apply-trace-timing.mjs.",
      "required": ["source"],
      "additionalProperties": false,
      "properties": {
        "source": {
          "enum": ["trace", "none"],
          "description": "trace = measured from the Playwright CLI trace (includes model thinking time between commands). none = no trace was available."
        },
        "matched": { "type": "integer", "minimum": 0, "description": "Number of CLI actions in action_log matched to a trace command." },
        "cli_actions": { "type": "integer", "minimum": 0, "description": "Number of actions in action_log that should correspond to a CLI command." }
      }
    },
    "outcome": {
      "enum": ["completed", "abandoned", "blocked", "error"]
    },
    "narrative": {
      "type": "string",
      "description": "ペルソナ視点での一人称ナレーション"
    },
    "findings": {
      "type": "array",
      "items": {
        "type": "object",
        "required": ["category", "severity", "description"],
        "properties": {
          "category": {
            "enum": ["usability", "bug", "accessibility", "copywriting", "performance", "trust"]
          },
          "severity": { "enum": ["low", "medium", "high", "critical"] },
          "page": {
            "type": "string",
            "description": "指摘した画面の URL またはパス（例: '/products/new'）。aggregate は page 単位で同じ問題を束ねる"
          },
          "element": {
            "type": "string",
            "description": "画面上の UI 要素名。画面に表示されている文言で書く（例: '「スキップ」ボタン'）"
          },
          "location": {
            "type": "string",
            "description": "自由文の場所の説明。page / element で表せない補足に使う"
          },
          "description": { "type": "string" },
          "quote": {
            "type": "string",
            "description": "ペルソナの生の声（一人称）"
          },
          "screenshot": { "type": "string" },
          "suggestion": { "type": "string" }
        }
      }
    },
    "score": {
      "type": "object",
      "properties": {
        "overall": { "type": "number", "minimum": 0, "maximum": 10 },
        "would_recommend": { "type": "boolean" }
      }
    },
    "action_log": {
      "type": "array",
      "description": "Action trace recorded by persona-runner in the order performed. at_seconds is filled in afterwards from the CLI trace. Drives behavior_metrics computation in aggregate.mjs.",
      "items": {
        "type": "object",
        "required": ["action"],
        "additionalProperties": false,
        "properties": {
          "at_seconds": {
            "type": "number",
            "minimum": 0,
            "description": "Seconds since the first CLI command, measured from the CLI trace. Absent when the action could not be matched to the trace."
          },
          "action": {
            "enum": [
              "navigate",
              "snapshot",
              "click",
              "type",
              "select",
              "press_key",
              "scroll",
              "wait",
              "back",
              "cancel",
              "screenshot",
              "give_up"
            ]
          },
          "target_desc": {
            "type": "string",
            "description": "Human-readable description of the element / URL acted upon (e.g. 'メアド入力欄', 'http://x/login')."
          },
          "location": {
            "type": "string",
            "description": "Logical screen identifier, e.g. URL or step name. Used to compute time-on-screen and back/cancel rate per screen."
          },
          "note": {
            "type": "string",
            "description": "Optional free-text annotation (e.g. '迷った', '戻った')."
          },
          "hesitated": {
            "type": "boolean",
            "description": "Self-reported by the persona: true when it was unsure what to do before this action. Counted as a behavior signal."
          }
        }
      }
    }
  },
  "allOf": [
    {
      "if": {
        "properties": { "outcome": { "enum": ["abandoned", "blocked", "error"] } },
        "required": ["outcome"]
      },
      "then": {
        "properties": {
          "findings": { "minItems": 1 }
        }
      }
    }
  ]
}
